"ch43tab";"i.id0";"ET";"i.name.no";"Status";"Datakilde";"Startar";"Frekvens (ar)";"Romlig opplosning";"ECT";"ECT2";"Egenskap";"Dir";"Ref.verdi";"Merknad";"i.description";"i.cpl.issues";"i.comments.all"
"frw";"ANC";"e i";"Vannets syrenøytraliserende kapasitet (ANC)";"2";"Various institutes/consultancies + Vannmiljø";;"1";"annet";"A2";"A2";"af";"p";"mdc";"";"Physico-chemical supporting element for acidification.  Reference-value and class-boundaries based on the correlation with acid-sensitive invertbrates. One of three parameters used for assessment of acidification (status is based on mean nEQR if all indices are calculated).";"";"True index value in Vannmiljø, can calculate EQR and nEQR ### d.spat.res: May vary from 1 to 6 (12?) for time-series datasets  ## d.them.scope: Water-bodies in rivers (streches of approx 5 km), respectively Lakes"
"frw";"AIP";"e";"Forsuringsindeks for begroingsalger i elv (AIP)";"2";"NIVA (Suzanne Schneider) + Vannmiljø";;"1";"annet";"A2";"A2, B1a, B1a";"bm";"n";"mdc";"";"The indicator includes an assessment of the taxonomic composition, covering most groups of benthic algae (Chyanophyceae, Chlorophyceae, Radophyceae, Phaeophyceae, Chrysophyceae and Xanthophyceae - Bacillariophyceae is not included); mainly identified to species level: this is based on the indicator value for each taxon (increasing value with increasing tolerance to acidification, where tolerance is based on dose-response relationship between each taxon and acidification (pH-optimum))";"";"May be reported as true parameter value or scaled value (EQR) or normalised scaled values (nEQR) ### d.spat.res: May vary from 2 to 6 (12?) for time-series datasets. More data available as ""single time"" datasets. ## d.them.scope: Water-bodies in rivers (streches of approx 5 km)"
"frw";"TIc";"i";"Vannplanteindeks for eutrofiering i innsjøer (TIc)";"2";"NIVA (Marit Mjelde) + Vannmiljø";;"1";"annet";"A2";"A2, B1a, B1a";"bm";"p";"mdc";"For få datapunkt";"The indicator includes an assessment of taxonomic composition, covering the full macrophyte community (iseotids, elodeids, numphaeids, lemnids and calcarous macroalgae - mosses, benthic algae and helophytes are not includes): this is based on number of sensitive species minus number of tolerant species relative to the total species number which also includes indifferent species (macrophytes are devided in three groups based on their response to eutrophication measured as total phosphorous (TP)).";"";"May be reported as true parameter value or scaled value (EQR) or normalised scaled values (nEQR) ### d.spat.res: May vary from 2 to 6 (12?) for time-series datasets. More data available as ""single time"" datasets. ## d.them.scope: Lakes"
"frw";"SIc";"i";"Vannplanteindeks for forsuring i innsjøer (SIc)";"2";"NIVA (Marit Mjelde) + Vannmiljø";;"1";"annet";"A2";"A2, B1a, B1a";"bm";"p";"mdc";"For få datapunkt";"The indicator includes an assessment of taxonomic composition, covering the full macrophyte community (iseotids, elodeids, numphaeids, lemnids and calcarous macroalgae - mosses, benthic algae and helophytes are not includes): this is based on number of sensitive species minus number of tolerant species relative to the total species number which also includes indifferent species (macrophytes are devided in three groups based on their response to acidification measured as pH).";"";"May be reported as true parameter value or scaled value (EQR) or normalised scaled values (nEQR) ### d.spat.res: May vary from 2 to 6 (12?) for time-series datasets. More data available as ""single time"" datasets. ## d.them.scope: Lakes"
"frw";"WIc";"i";"Vannplanteindeks for vannstandsvariasjoner i reguleringsmagasin (WIc)";"2";"NIVA (Marit Mjelde) + Vannmiljø";;"1";"annet";"A1";"A1, B1a, B1a";"bm";"p";"mdc";"For få datapunkt";"The indicator includes an assessment of taxonomic composition, covering the full macrophyte community (iseotids, elodeids, numphaeids, lemnids and calcarous macroalgae - mosses, benthic algae and helophytes are not includes), identified to species level: this is based on number of sensitive species minus number of tolerant species relative to the total species number which also includes indifferent species (macrophytes are devided in three groups based on their response to maximum water level reduction during winter, measured in metre).";"";"May be reported as true parameter value or scaled value (EQR) or normalised scaled values (nEQR) ### d.spat.res: May vary from 2 to 6 (12?) for time-series datasets. More data available as ""single time"" datasets. ## d.them.scope: Lakes"
"frw";"PIT";"e";"Eutrofieringsindeks for begroingsalger i elv (PIT)";"2";"NIVA (Suzanne Schneider) + Vannmiljø";;"1";"annet";"A2";"A2, B1a, B1a";"bm";"n";"mdc";"";"The indicator includes an assessment of the taxonomic composition, covering most groups of benthic algae (Chyanophyceae, Chlorophyceae, Radophyceae, Phaeophyceae, Chrysophyceae and Xanthophyceae - Bacillariophyceae is not included), mainly identified to species level: this is based on the indicator value for each taxon (increasing value with increasing tolerance to eutrophication/nutrient input, where tolerance is based on dose-response relationship between each taxon and total phosporous (TP-optimum))";"";"May be reported as true parameter value or scaled value (EQR) or normalised scaled values (nEQR) ### d.spat.res: May vary from 2 to 6 (12?) for time-series datasets. More data available as ""single time"" datasets. ## d.them.scope: Water-bodies in rivers (streches of approx 5 km)"
"frw";"ASPT";"e";"Average Score Per Taxon - litorale bunndyr i elver (ASPT)";"2";"Various institutes/consultancies + Vannmiljø";;"1";"annet";"A2";"A2, B1a, B1a";"bm";"p";"mdc";"";"The indicator includes an assessment of the taxonomic composition, covering most groups of benthic macroinvertebrates identified to a higher taxonomic level (family or class; specified for each taxonomic group): this is based on the indicator value for each taxon (decreasing value with increasing tolerance to eutrophication/organic pollution, where tolerance is based on dose-response relationship between each taxon and eutrophication measured as TP or organic pollution measured as DOC?). ASPT is calculated as the mean of scores for all indicator taxa in the sample";"";"True index value in Vannmiljø, can calculate EQR and nEQR ### d.spat.res: May vary from 1 to 6 (12?) for time-series datasets.  ## d.them.scope: Water-bodies in rivers (streches of approx 5 km)"
"frw";"RAMI";"e";"Forsuringsindeks for litorale bunndyr i elver (RAMI)";"2";"Various institutes/consultancies + Vannmiljø";;"1";"annet";"A2";"A2, B1a, B1a";"bm";"p";"mdc";"";"The indicator includes an assessment of taxonomic composition and relative abundance, covering the full macroinvertebrate community, identified mainly to species or genus level: this is based on the indicator value for each taxon (decreasing value with increasing tolerance to acidification, where tolerance is based on dose-response relationship between each taxon and acidification (pH-optimum and range)), and the relative abundance (counts) of each taxon in a sample.";"";"AKS: RAMI and LAMI is based on information on indicator taxa and their sensitivity to acidification as used in Raddum-1/Raddum-2 but also other acidification indices (macroinvertebrate-based) used in Northern Europe. RAMI and Raddum-2 (rivers) is positively correlated with relatively high concentration. LAMI and Raddum-1 (lakes) show a weak but positive correlation. Non of the indicators used for lakes (MultiClear, Raddum-1, LAMI) works very well along the whole acidification gradient. In the classification of ecological status we use all three indicators (if available) and calculate the mean (nEQR) value. Raddum-2 and RAMI generally works better - RAMI is more sensitive under weak acidification whereas Raddum-2 works better to differentiate between levels of moderate and strong acidification. | True index value in Vannmiljø, can calculate EQR and nEQR ### d.spat.res: May vary from 1 to 6 (12?) for time-series datasets.  ## d.them.scope: Water-bodies in rivers (streches of approx 5 km)"
"frw";"LAMI";"i";"Forsuringsindeks for litorale bunndyr i innsjøer (LAMI)";"2";"Various institutes/consultancies + Vannmiljø";;"1";"annet";"A2";"A2, B1a, B1a";"bm";"p";"mdc";"";"The indicator includes an assessment of taxonomic composition, covering the full macroinvertebrate community, mainly identified to species or genus level: this is based on the indicator value for each taxon (decreasing value with increasing tolerance to acidification, where tolerance is based on dose-response relationship between each taxon and acidification (pH-optimum)). One of three indices based on litoral macroinvertebrates used for assessment of lake acidification (status is based on mean nEQR if all indices are calculated).";"";"AKS: RAMI and LAMI is based on information on indicator taxa and their sensitivity to acidification as used in Raddum-1/Raddum-2 but also other acidification indices (macroinvertebrate-based) used in Northern Europe. RAMI and Raddum-2 (rivers) is positively correlated with relatively high concentration. LAMI and Raddum-1 (lakes) show a weak but positive correlation. Non of the indicators used for lakes (MultiClear, Raddum-1, LAMI) works very well along the whole acidification gradient. In the classification of ecological status we use all three indicators (if available) and calculate the mean (nEQR) value. Raddum-2 and RAMI generally works better - RAMI is more sensitive under weak acidification whereas Raddum-2 works better to differentiate between levels of moderate and strong acidification. | True index value in Vannmiljø, can calculate EQR and nEQR ### d.spat.res: May vary from 1 to 6 (12?) for time-series datasets.  ## d.them.scope: Lakes"
"frw";"Raddum-2";"e i";"Litorale bunndyr i elver (Raddum forsuringsindeks-2)";"2";"Various institutes/consultancies + Vannmiljø";;"1";"annet";"A2";"A2, B1a, B1a";"bm";"p";"mdc";"For få datapunkt alene, men kan slås sammen med Raddum-2";"The indicator includes an assessment of taxonomic composition and relative abundance, covering the full macroinvertebrate community, mainly identified to species or genus level: this is based on the indicator value for each taxon (decreasing value with increasing tolerance to acidification, where tolerance is based on dose-response relationship between each taxon and acidification (pH-optimum), grouped into 4 tolerance classes) and the relative abundance of the main acid sentive taxa group (the abundance of very acid-sensitive Ephemeroptera realtive to the abundance of acid-tolerant Plecoptera).";"";"AKS: RAMI and LAMI is based on information on indicator taxa and their sensitivity to acidification as used in Raddum-1/Raddum-2 but also other acidification indices (macroinvertebrate-based) used in Northern Europe. RAMI and Raddum-2 (rivers) is positively correlated with relatively high concentration. LAMI and Raddum-1 (lakes) show a weak but positive correlation. Non of the indicators used for lakes (MultiClear, Raddum-1, LAMI) works very well along the whole acidification gradient. In the classification of ecological status we use all three indicators (if available) and calculate the mean (nEQR) value. Raddum-2 and RAMI generally works better - RAMI is more sensitive under weak acidification whereas Raddum-2 works better to differentiate between levels of moderate and strong acidification. | True index value in Vannmiljø, can calculate EQR and nEQR ### d.spat.res: May vary from 1 to 6 (12?) for time-series datasets.  ## d.them.scope: Water-bodies in rivers (streches of approx 5 km)"
"frw";"Raddum-1";"e";"Litorale bunndyr i elver og innsjøer (Raddum forsuringsindeks-1)";"2";"Various institutes/consultancies + Vannmiljø";;"1";"annet";"A2";"A2, B1a, B1a";"bm";"p";"oth";"";"The indicator includes an assessment of taxonomic composition, covering the full macroinvertebrate community, mainly identified to species or genus level: this is based on the indicator value for each taxon (decreasing value with increasing tolerance to acidification, where tolerance is based on dose-response relationship between each taxon and acidification (pH-optimum), grouped into 4 tolerance classes). One of three indices based on litoral macroinvertebrates used for assessment of lake acidification (status is based on mean nEQR if all indices are calculated).";"";"AKS: RAMI and LAMI is based on information on indicator taxa and their sensitivity to acidification as used in Raddum-1/Raddum-2 but also other acidification indices (macroinvertebrate-based) used in Northern Europe. RAMI and Raddum-2 (rivers) is positively correlated with relatively high concentration. LAMI and Raddum-1 (lakes) show a weak but positive correlation. Non of the indicators used for lakes (MultiClear, Raddum-1, LAMI) works very well along the whole acidification gradient. In the classification of ecological status we use all three indicators (if available) and calculate the mean (nEQR) value. Raddum-2 and RAMI generally works better - RAMI is more sensitive under weak acidification whereas Raddum-2 works better to differentiate between levels of moderate and strong acidification. | True index value in Vannmiljø, can calculate EQR and nEQR ### d.spat.res: May vary from 1 to 6 (12?) for time-series datasets.  ## d.them.scope: Lakes"
"frw";"MultiClear";"i";"Multimetrisk bunndyrindeks for forsuring av klare innsjøer (MultiClear)";"2";"Various institutes/consultancies + Vannmiljø";;"1";"annet";"A2";"A2, B1a, B1a";"bm";"p";"mdc";"";"The indicator includes an assessment of taxonomic diversity, taxonomic composition and relative abundance, covering the full macroinvertebrate community, mainly identified to species or genus level: this is based on four sub-indices where one of these are a multimetric index in itself: 1)  number of Gastropoda taxa, 2) number of Ephemeroptera taxa, 3) the indicator value for each taxon (decreasing value with increasing tolerance to acidification, where tolerance is based on dose-response relationship between each taxon and acidification (pH-optimum), grouped into 6 tolerance classes), 4) modified Henriksson & Medins index (MORE INFO CAN BE PROVIDED IF NECESSARY). One of three indices based on litoral macroinvertebrates used for assessment of lake acidification (status is based on mean nEQR if all indices are calculated).";"composite index (a)";"True index value in Vannmiljø, can calculate EQR and nEQR ### d.spat.res: May vary from 1 to 6 (12?) for time-series datasets.  ## d.them.scope: Lakes ## ect.s2: almost B1a, but too much focus on acidification... :("
"frw";"EMANTLLE";"e";"Elvemusling (Margaritifera margaritifera) - terskelindikator i elv";"2";"NINA  + Vannmiljø";;"1";"annet";"B1a";"B1a";"bm";"??";"exp";"Ingen data i Vannmiljø";"The indicator includes an assessment of the abundances and size distribution of river pearl mussel (Margaritifera margaritiferea). The indicator is used to differenciate between classes of ecological status based on the total abundance of mussels and the relative occurance of three size categories. Good ecological conditions require that the size distribution indicate good recruitment of mussels.";"composite index (a)";"??Ecological status category set on basis of a combination of three different parameters. Each of these are given as % occurance ### d.them.scope: Water-bodies in rivers (streches of approx 5 km)"
"frw";"HBI2";"e";"Heterotrof begroingsindeks for elv (HBI2)";"2";"NIVA  + Vannmiljø";;"1";"annet";"A2";"A2, B1a, B1a";"bm";"n";"mdc";"For få datapunkt";"A measure of loads of organic matter in rivers, measured as heterotrophic growth based on the occurance of the fungus Leptomitus lacteus and/or the bacteria Sphaerotilus natans («lammehaler»). The HBI2 is calculated from a combination of measured thickness (in cm) and the the degree of coverage (in %) of heterotrophic growth.";"";"May be reported as true parameter value or scaled value (EQR) or normalised scaled values (nEQR) ### d.spat.res: May vary from 2 to 6 (12?) for time-series datasets. More data available as ""single time"" datasets. ## d.them.scope: Water-bodies in rivers (streches of approx 5 km)"
"frw";"PTI";"i";"Planteplankton Trofisk indeks (PTI)";"2";"NIVA (Birger Skjelbred) + Vannmiljø";;"1";"annet";"A2";"A2, B1a, B1a";"bm";"n";"mdc";"";"The indicator includes an assessment of taxonomic composition and relative abundance, covering the full phytoplankton community, mainly identified to species level: this is based on the indicator value for each taxon (increasing value with increasing tolerance to eutrophication/nutrient input, where tolerance is based on dose-response relationship between each taxon and total phosporous (TP)), and the relative abundance (biovolume) of each taxon in a sample. This is one of four phytoplankton indicators included in the assessment of lake eutrophication, Nowegian classification system re WFD";"";"True index value in Vannmiljø, can calculate EQR and nEQR ### d.spat.res: May vary from 1 to 6 (12?) for time-series datasets. More data available as ""single time"" datasets. ## d.them.scope: Lakes ## r.hea: For all WFD indicators, r.dir=pos when calculating EQR and nEQR, regardless the shape of the relationship between the variable/index and underlying normative interpretation."
"frw";"LACI-1";"i";"Forsuringindeks for småkreps i svært kalkfattige innsjøer (LACI-1)";"2";"NINA (Ann Kristin Schartau) + Vannmiljø";;"1";"annet";"A2";"A2, B1a, B1a";"bm";"p";"mdc";"For få datapunkt";"The indicator includes an assessment of taxonomic composition of two microcrustacean zooplankton groups (Cladocera and Copepoda), identified to species : this is based on number of sensitive species relative to the total species number (devided into three goups based on their response to acidification measured as pH - sensitive, tolerant and idifferent).";"";"True index value in Vannmiljø, can calculate EQR and nEQR ### d.spat.res: May vary from 1 to 6 (12?) for time-series datasets.  ## d.them.scope: Lakes"
"frw";"LACI-2";"i";"Forsuringindeks for småkreps i kalkfattige innsjøer (LACI-2)";"2";"NINA (Ann Kristin Schartau) + Vannmiljø";;"1";"annet";"A2";"A2, B1a, B1a";"bm";"p";"mdc";"For få datapunkt";"The indicator includes an assessment of taxonomic diversity and taxonomic composition of two microcrustacean zooplankton groups (Cladocera and Copepoda), identified to species level: this is based on number of sensitive species relative to the total species number (devided into five goups based on their response to acidification measured as pH) and the total number of species relative to the expected species pool for the region.";"";"True index value in Vannmiljø, can calculate EQR and nEQR ### d.spat.res: May vary from 1 to 6 (12?) for time-series datasets.  ## d.them.scope: Lakes"
"frw";"NEFI";"e i";"Norsk endringsindeks for fisk - elver og innsjøer (NEFI)";"2";"NINA  + Vannmiljø";;"1";"annet";"B1b";"B1b";"bm";"p";"mdc";"Grunnlagsdata i Vannmiljø?";"The indicator includes an assessment of taxonomic composition and abundances, covering the full fish community: this is based on changes in dominance (devided in three categories - dominant, common and rare), calculated as number of lost species and number of species with reduced dominance.";"quantifies change/trend (t)";"True index value in Vannmiljø = nEQR ### d.spat.res: May vary from 1 to 6 (12?) for time-series datasets.  ## d.them.scope: Water-bodies in rivers (streches of approx 5 km), respectively Lakes"
"frw";"FIBESTE";"e i";"Bestandsendring fisk";"2";"NINA  + Vannmiljø";;"1";"annet";"B1a";"B1a";"bm";"n";"mdc";"Grunnlagsdata i Vannmiljø?";"A measure of the reduction in abundances of native fish species measured as shift in dominance category (rare, common, dominant), where reduction in dominant species have a larger influence on the indicator value than reduction in common or rare species.";"quantifies change/trend (t)";"True index value in Vannmiljø. Can calculate EQR and nEQR ### d.spat.res: May vary from 1 to 6 (12?) for time-series datasets.  ## d.them.scope: Water-bodies in rivers (streches of approx 5 km), respectively Lakes"
"frw";"EIndexW3";"i";"Eutrofieringsindeks for fisk i innsjøer (EIndexW3)";"2";"NINA  + Vannmiljø";;"1";"annet";"A2";"A2, B1a, B1a";"bm";"p";"oth";"For få datapunkt";"The indicator includes an assessment of taxonomic composition, abundances, sizes and functional traits, covering the full fish community: this is based on fish abundance (Cpue), body-size of perch and relative abundance of predatory perch";"composite index (a)";"Normalised scaled values (nEQR) ### d.spat.res: May vary from 1 to 6 (12?) for time-series datasets.  ## d.them.scope: Lakes"
"frw";"AIndexW5";"i";"Forsuringsindeks for fisk i innsjøer (AIndexW5)";"2";"NINA  + Vannmiljø";;"1";"annet";"A2";"A2, B1a, B1a";"bm";"p";"oth";"For få datapunkt";"The indicator includes an assessment of taxonomic composition, abundances, sizes and functional traits, covering the full fish community: this is based on number of fish species, abundance (Cpue) of roach, body-size of roach, relative abundance of carp fishes and relative abundance of predatory perch";"composite index (a)";"Normalised scaled values (nEQR) ### d.spat.res: May vary from 1 to 6 (12?) for time-series datasets.  ## d.them.scope: Lakes"
"frw";"WS-FBI";"i";"Pelagisk fiskeindeks for innsjøer (WS-FBI)";"2";"NINA  + Vannmiljø";;"1";"annet";"B1a";"B1a";"bm";"p";"mdc";"For få datapunkt";"The indicator is a measure of the total fish biomass in pelagic habitats (BMTot) and how this is distributed in respectively epilimnion and hypolimnion (BMHypo/BMEpi), by use of hydroacustics.";"";"True index value in Vannmiljø, can calculate EQR and nEQR ### d.spat.res: May vary from 1 to 6 (12?) for time-series datasets.  ## d.them.scope: Lakes"
"frw";"Cpue_BrownTrout";"i";"Bestandsstørrelse av brunørret relatert til innsjøers oppvekstratio (OR) (Cpue_aure)";"2";"NINA  + Vannmiljø";;"1";"annet";"B1a";"B1a";"bm";"p";"mdc";"Data???";"The indicator includes an assessment of the population size of brown trout (Salmo trutta) based on numbers of fish per unit effort (Cpue: 100 m2 multimesh fishnet per night). This is compared to a reference value given the ""area suitable for reqruitment and growth"" (OR) in inlet- and outlet-rivers to the lake. OR is divided into three categories (low, medium, large) which give three different reference values for Cpue_BrowinTrout (increasing reference value with increasing OR).";"";"May be reported as true index value or scaled value (EQR) or normalised scaled values (nEQR) ### d.spat.res: May vary from 1 to 6 (12?) for time-series datasets.  ## d.them.scope: Lakes"
"frw";"Cpue_juveniles";"e";"Tetthet av ungfisk i elver basert på laks og ørret (Cpue_juveniles)";"2";"NINA  + Vannmiljø";;"1";"annet";"B1a";"B1a";"bm";"p";"oth";"Grunnlagsdata i Vannmiljø?";"The indicator includes an assessment of the abundances of salmon (Salmo salaris), brown trout (Salmo trutta) and arctic charr (Salvelinus alpinus) based on numbers of juveniles per unit effort (100 m2 river habitat). The Cpue is compared to a ""reference value"" (ie. boundary high/good ecological state) based on a combination of migration pattern (anadromous, stationary), coexistence of fish species (allopatric, sympatric) and quality of fish habitats (very good, suitable and not suitable).";"";"True index value or normalized scaled value (nEQR) ### d.spat.res: May vary from 1 to 6 (12?) for time-series datasets.  ## d.them.scope: Water-bodies in rivers (streches of approx 5 km)"
"frw";"KLFA";"i";"Klorofyll planteplankton";"2";"NIVA (Birger Skjelbred) + Vannmiljø";;"1";"annet";"B2";"B2, B3";"pr";"n";"mdc";"";"Chlorophyll a, spectrophotometric measurement of chlorophyll a after extraction with 90% acetone or 100% methanol. (There is also an in situ fluorescence measurement method, KLFA-FLU, which is not (yet) used for classifying conditions according to WFD.)";"";"True index value in Vannmiljø, can calculate EQR and nEQR ### d.spat.res: May vary from 1 to 6 (12?) for time-series datasets. More data available as ""single time"" datasets. ## r.hea: For all WFD indicators, r.dir=pos when calculating EQR and nEQR, regardless the shape of the relationship between the variable/index and underlying normative interpretation."
"frw";"PPBIOMTOVO";"i";"Total biomasse planteplankton per volumenhet";"2";"NIVA (Birger Skjelbred) + Vannmiljø";;"1";"annet";"B2";"B2, B1a, B1a";"pr";"n";"mdc";"";"A measure of total phytoplankton biomass in lakes, based on calculated biovolume multiplied with the densities of each taxon in the sample. This is one of four phytoplankton indicators included in the assessment of lake eutrophication, Nowegian classification system re WFD";"";"True index value in Vannmiljø, can calculate EQR and nEQR ### d.spat.res: May vary from 1 to 6 (12?) for time-series datasets. More data available as ""single time"" datasets. ## d.them.scope: Lakes ## r.hea: For all WFD indicators, r.dir=pos when calculating EQR and nEQR, regardless the shape of the relationship between the variable/index and underlying normative interpretation."
