"ch43tab";"i.id0";"ET";"i.name.no";"Status";"Datakilde";"Startar";"Frekvens (ar)";"Romlig opplosning";"ECT";"ECT2";"Egenskap";"Dir";"Ref.verdi";"Merknad";"i.description";"i.cpl.issues";"i.comments.all"
"urb";"sk.01, vs.01";"";"Maksimal grønnhet";"2";"NASA*, Copernicus*";"2000";"1";"~100 m";"B2";"B2, B3";"pr";"u";"mdc";"Variabel må avklares";"The indicator is the deviation of the annual maximum NDVI value per MODIS pixel from a modelled ""reference value"" for that pixel. This is a two-sided indicator where values both lower and higher than the reference value may indicate degraded ecosystem condition.";"unclear directionality (d)";"The normalisation (using pixelwise modelled reference states) as explained here is optimised for forests -- adaptation to other ETs might require further research ### n32: EF: NDVI can only be related to aggregated 'open lowland' due to lack of relevant ecosystem maps BC: then the directionality (meaning, relevance) of this var is even more questionable ## n41: BC: I reduced the status for forests due to the apparent need for methodological harmonistaion ## d.startdate:  _____________ See cell note [[103]]  The cell note will appear in the sidebar if you have the Cell Notes add-on installed and opened.For help see bit.ly/cell_notes ## d.spat.scope: the instantaneous NDVI values definitely need some ""intra-annual aggregation"" to get a meaningful EC variable  IndiPri talks about ""annual max values""  TODO: explore & discuss what is being / can be done here"
"urb";"ur.01";"";"Andel tette kunstige flater";"2";"Copernicus*, NIBIO";"2006";"3";"kommune";"A1";"A1, B2, C1";"af, lm";"n";"pol?";"NIBIOs nasjonale grønnstrukturkart, våren 2024; oppdateringsfrekvens er uavklart";"Share of impervious surfaces";"conflated with extent (e)";"possibly meaningful for other ETs too (e.g. linked to cabin+road density) ### d.startdate: EF: NIBIO is coming with  national green structure map (including grey and blue areas) before Easter 2024 ## d.them.scope: EF: while the data source has a relatively fine spatial resolution, the spat.res for the variable shd be ""p1"" (kommune) ## i.etlink: imperviousness (A1) & green cover (B2) are complementary hence highly collinear"
"urb";"ur.02";"";"Andel grønt areal";"2";"Copernicus*, NIBIO";"2018";"3";"kommune";"B2";"B2, A1, C1";"fs, lm";"p";"pol?";"NIBIOs nasjonale grønnstrukturkart, våren 2024; oppdateringsfrekvens er uavklart";"Share of green surfaces in an urban ecosystem";"conflated with extent (e)";"highly correlated with imperviousness ### d.startdate: EF: NIBIO is coming with  national green structure map (including grey and blue areas) before Easter 2024 ## d.them.scope: EF: while the data source has a relatively fine spatial resolution, the spat.res for the variable shd be ""p1"" (kommune) ## i.etlink: imperviousness (A1) & green cover (B2) are complementary hence highly collinear"
"urb";"nn.01";"";"Andel ferskvannsareal";"1";"Copernicus*, NIBIO";"2018";"3";"kommune";"B2";"B2, A1, C1";"fs, lm";"p";"mod";"NIBIOs nasjonale grønnstrukturkart, våren 2024; oppdateringsfrekvens er uavklart";"Share of freshwater surfaces within an urban ecosystem";"";"feasible EU volutary variable; NIBIO is coming with  national green structure map (including grey and blue areas) before Easter 2024 ### d.startdate: EF: NIBIO is coming with  national green structure map (including grey and blue areas) before Easter 2024 ## d.them.scope: EF: while the data source has a relatively fine spatial resolution, the spat.res for the variable shd be ""p1"" (kommune)"
"urb";"ur.03";"";"Andel trekronedekke";"2";"Copernicus*, NIBIO";"2012";"3";"kommune";"B2";"B2";"fs";"p";"pol?";"NIBIOs nasjonale grønnstrukturkart, våren 2024; oppdateringsfrekvens er uavklart";"Tree cover density";"";"In several municipalities (e.g. Oslo) there are better local data sources ### d.startdate: EF: NIBIO is coming with  national green structure map (including grey and blue areas) before Easter 2024 ## d.them.scope: EF: while the data source has a relatively fine spatial resolution, the spat.res for the variable shd be ""p1"" (kommune)"
"urb";"nn.02";"";"Konnektivitet av grønne områder";"1";"Copernicus*, NIBIO";"2018";"3";"kommune";"C1";"C1";"lm";"p";"mod";"Variabel må avklares";"The a specific metric still needs to be developed";"";"I think this could be a useful variable for urban ecosystems, but a specific metric must be developed; NIBIO's map would provide relevant data ### d.startdate: EF: NIBIO is coming with  national green structure map (including grey and blue areas) before Easter 2024"
"urb";"ur.04";"";"Konsentrasjon av partikler <2,5 μm (PM2.5)";"2";"Copernicus*, NILU";"2018";"1";"kommune";"A2";"A2, A1";"af";"n";"pol?";"Påvirkningsvariabel, lite relevant som økologisk tilstandsvariabel";"Average annual particulate matter (PM2.5) concentration in urban ecosystems";"";"JRC report studies PM2.5 & PM10, but indicators for other pollutants are also possible (NO2, O3, SO2, CO), and NO data sources should be also examined. At an EU level the max monthly mean values seem to make a better indicator. ### d.temp.aggr: CAMS predecessors (EMEP, EEA/AQ) go back to 2000 (NO data may go back even further...) ## d.spat.scope: JRC also explores other options (max monthly mean, annual max), which may be more relevant ## ect.s2: BC: FWIW, aerosol particles could also be seen as ""physical quality"" (but I left it in A2, anyway)"
"urb";"!e.01.1";"";"Green areas in cities and adjacent towns and suburbs";"M";"";;;"";"B2";"B2, A1, C1";"";"p";"";"";"Green areas in cities and adjacent towns and suburbs";"other issues (o)";" ### "
"urb";"!e.01.2";"";"Concentration of PM2.5";"M";"";;;"";"A2";"A2, A2";"";"n";"";"";"Concentration of Particulate Matter (PM) with a diameter up to 2.5 μm";"";" ### "
"urb";"e.01.3";"";"Share of artificial impervious area cover";"V";"";;;"";"A1";"A1, C1";"";"n";"";"";"Share of artificial impervious area cover";"other issues (o)";" ### "
"urb";"e.01.4";"";"Ground ozone concentration";"V";"";;;"";"A2";"A2";"";"n";"";"";"Ground ozone concentration (O3)";"";"BC: (repeated) how will these different pollutants become ONE indicator? (Or are they separate indicators? Should the MS choose? A piece of info/guidance is missing.) ### "
"urb";"e.01.5";"";"Tree canopy cover density";"V";"";;;"";"B2";"B2";"";"p";"";"";"Tree canopy cover density";"";"BC: (data) This is the same HRL product (TCD) and essentially the same indicator as in the mandatory forest indicator. I made a few minor corrections in both lines, including harmonising the name. ### "
"urb";"e.01.6";"";"Blue areas in cities";"V";"";;;"";"C1";"C1, A1";"";"p";"";"";"Blue areas in cities";"";" ### "
"urb";"e.01.7";"";"Accessible urban green";"V";"";;;"";"C1";"C1, X, B2, B3";"";"p";"";"";"Accessible urban green (e.g parks)";"conflated with services (s), unclear link to ECT (i)";" ### "
"opn";"sk.04, fj.09, vs.29";"g h l k f";"Fravær av fremmede planter";"3";"MDir";"2020";"3";"fylke/region";"B1a";"B1a";"fs, bm";"p";"abs";"dekker delvis EUs variabel";"A (reversed) cover of alient plants: the indicator is the proportion of the area without such alien species (i.e., 100% - total cover (%) of alien species). The indicator used for in the forest and mountains is different from the one developed for wetlands, semi-natural and naturally open ecosystems. The first one is based on ANO data, while the second one uses mainly nature mapping data and a special stratified aggregation technique.";"";" ### d.temp.res: ALK: The original units are %cover recorded along an ordinal four-step scale. ## d.temp.aggr: ALK: The data series starts in 2018, but the years 2018-2022 are pooled, and then the indicator is either set to represent 2020 or 2022 ## d.spat.res: the full ANO update cycle is 5 years (return period to each sampling site), shorter periods may be possible at the expense of accuracy & spatial/thematic resolution (for a subset of sites sampled in the period) ## r.hea: for historical reasons the indicator is the _inverted cover_ (absence) of invasies, which is thus positive. As the SEEA EA can nicely handle negative indicators, and the _cover_ of invasives gives a simpler & more intuitive indicator, it might make sense to use the simpler version in the future."
"opn";"sk.03, vs.30";"g h l k f";"Vegetasjon og fuktighet";"2";"MDir, NINA (Anders Kolstad)";"2019";"1";"fylke/region";"A1";"A1, B1a, B1a";"af";"u";"mod";"ANOs plantedata er kanskje lite relevante for lite vegetert mark og kyst";"The indicator is the mean ""moisture affinity score"" (Tyler et al. 2021) of the vascular plant species in the ground layer, weighted with the frequency of each species. This is a two-sided indicator where values both lower and higher than the reference value may indicate deviation from good ecological condition. (Previous versions of this indicator used in the forest assessment relied on Ellenberg F scores.)";"";" ### n32: NIBIO: additonal data for n22 & n51 from 3Q ## d.startdate:  _____________ See cell note [[101]]  The cell note will appear in the sidebar if you have the Cell Notes add-on installed and opened.For help see bit.ly/cell_notes ## d.temp.res: Previous versions (skog, fjell...) used the slightly diffferent Ellenberg scales ## d.temp.aggr: ANO data so far only cover samples from 2019+2020 for forests and 2019-2021 for mountains; the first full cycle of data collection will cover 2019-2023; thereafter repeated in 5-yr cycles. This pertains to all ANO-based indicators. ## d.spat.res: the full ANO update cycle is 5 years (return period to each sampling site), shorter periods may be possible at the expense of accuracy & spatial/thematic resolution (for a subset of sites sampled in the period) ## r.hea: Hanno: technically, this metric is divided into two one-sided indicators (one for ""too much..."" and the other one for ""too little..."")"
"opn";"fj.14, vs.04";"g h l k f";"Vegetasjon og lys";"2";"MDir, NINA (Anders Kolstad)";"2019";"1";"fylke/region";"B3";"B3, B1a, B1a";"fg";"u";"mod";"ANOs plantedata er kanskje lite relevante for lite vegetert mark og kyst";"The indicator is the mean ""light affinity score"" (Tyler et al. 2021) of the vascular plant species in the ground layer, weighted with the frequency of each species. This is a two-sided indicator where values both lower and higher than the reference value may indicate deviation from good ecological condition.  (Previous versions of this indicator used in the mountain assessment relied on Ellenberg L scores.)";"unclear directionality (d)";" ### i.name.no: Currently elaborated for mountains (each basic type in NiN's main types T3, T7, T14, T22) ## n32: NIBIO: additonal data for n22 & n51 from 3Q ## d.startdate:  _____________ See cell note [[101]]  The cell note will appear in the sidebar if you have the Cell Notes add-on installed and opened.For help see bit.ly/cell_notes ## d.temp.res: Previous versions (skog, fjell...) used the slightly diffferent Ellenberg scales ## d.temp.aggr: ANO data so far only cover samples from 2019+2020 for forests and 2019-2021 for mountains; the first full cycle of data collection will cover 2019-2023; thereafter repeated in 5-yr cycles. This pertains to all ANO-based indicators. ## d.spat.res: the full ANO update cycle is 5 years (return period to each sampling site), shorter periods may be possible at the expense of accuracy & spatial/thematic resolution (for a subset of sites sampled in the period) ## ect.s2: Balint: This is intentionally B3.  It is true that there are slight geographical differences in the amount of (total) light available to the vegetation (due to climatic and astronomical factors). But this indicator does not measure that one. Instead it measures how much light the ""focal layer"" of vegetation (typically the herbaceous layer) gets due to the closedness of canopy above it. Thus this is B3. ## r.hea: Hanno: technically, this metric is divided into two one-sided indicators (one for ""too much..."" and the other one for ""too little..."")"
"opn";"vs.41";"g h l k f";"Vegetasjon og pH";"2";"MDir, NINA (Anders Kolstad)";"2019";"1";"fylke/region";"A2";"A2, B1a, B1a";"af";"u";"mod";"ANOs plantedata er kanskje lite relevante for lite vegetert mark og kyst";"The indicator is the mean ""acidity affinity score"" (Tyler et al. 2021) of the vascular plant species in the ground layer, weighted with the frequency of each species. This is a two-sided indicator where values both lower and higher than the reference value may indicate deviation from good ecological condition.";"lack of sensitivity (stable) (x), unclear directionality (d)";" ### n32: NIBIO: additonal data for n22 & n51 from 3Q ## d.temp.aggr: ANO data so far only cover samples from 2019+2020 for forests and 2019-2021 for mountains; the first full cycle of data collection will cover 2019-2023; thereafter repeated in 5-yr cycles. This pertains to all ANO-based indicators. ## d.spat.res: the full ANO update cycle is 5 years (return period to each sampling site), shorter periods may be possible at the expense of accuracy & spatial/thematic resolution (for a subset of sites sampled in the period) ## r.hea: Hanno: technically, this metric is divided into two one-sided indicators (one for ""too much..."" and the other one for ""too little..."")"
"opn";"fj.15";"g h l k f";"Vegetasjonens varmekrav";"3";"MDir, NINA (Anders Kolstad)";"2019";"1";"fylke/region";"A1";"A1, B1a, B1a";"af";"n";"mod";"ANOs plantedata er kanskje lite relevante for lite vegetert mark og kyst";"The indicator is the relative cumulative cover of plant species with heat requirements above a specified threshold, based on cover data of all occurring vascular plant species collected in the ANO programme from selected NiN nature types (T3, T7, T14, T22), and values for heat requirements for Swedish plants from Tyler et al. (2021).";"lack of sensitivity (stable) (x), unclear directionality (d)";" ### i.name.no: Currently elaborated for mountains (each basic type in NiN's main types T3, T7, T14, T22) ## d.startdate:  _____________ See cell note [[101]]  The cell note will appear in the sidebar if you have the Cell Notes add-on installed and opened.For help see bit.ly/cell_notes ## d.temp.res: Previous versions (skog, fjell...) used the slightly diffferent Ellenberg scales ## d.temp.aggr: ANO data so far only cover samples from 2019+2020 for forests and 2019-2021 for mountains; the first full cycle of data collection will cover 2019-2023; thereafter repeated in 5-yr cycles. This pertains to all ANO-based indicators. ## d.spat.res: the full ANO update cycle is 5 years (return period to each sampling site), shorter periods may be possible at the expense of accuracy & spatial/thematic resolution (for a subset of sites sampled in the period) ## r.hea: Erik: this is a climate response metric with a unilateral (negative) interpretation, assuming that this a clear climate response and the current trends can go in one direction only"
"opn";"sk.02, fj.13, vs.03";"g h l k f";"Vegetasjon og nitrogen";"2";"MDir, NINA (Anders Kolstad)";"2019";"1";"fylke/region";"A2";"A2, B1a, B1a";"af";"u";"mod";"ANOs plantedata er kanskje lite relevante for lite vegetert mark og kyst";"The indicator is the mean ""nitrogen affinity score"" (Tyler et al. 2021) of the vascular plant species in the ground layer, weighted with the frequency of each species. This is a two-sided indicator where values both lower and higher than the reference value may indicate deviation from good ecological condition.  (Previous versions of this indicator used in the forest & mountain assessments relied on Ellenberg N scores.)";"";"May be correlated with NDVI (productivity). ### n32: NIBIO: additonal data for n22 & n51 from 3Q ## d.startdate:  _____________ See cell note [[101]]  The cell note will appear in the sidebar if you have the Cell Notes add-on installed and opened.For help see bit.ly/cell_notes ## d.temp.res: Previous versions (skog, fjell...) used the slightly diffferent Ellenberg scales ## d.temp.aggr: ANO data so far only cover samples from 2019+2020 for forests and 2019-2021 for mountains; the first full cycle of data collection will cover 2019-2023; thereafter repeated in 5-yr cycles. This pertains to all ANO-based indicators. ## d.spat.res: the full ANO update cycle is 5 years (return period to each sampling site), shorter periods may be possible at the expense of accuracy & spatial/thematic resolution (for a subset of sites sampled in the period) ## r.hea: Hanno: technically, this metric is divided into two one-sided indicators (one for ""too much..."" and the other one for ""too little..."")"
"opn";"vs.41b";"g h l k f";"Planteindikator på fosfor";"2";"MDir, NINA (Joachim Töpper)";"2019";"1";"fylke/region";"A2";"A2, B1a, B1a";"fg, bm";"u";"mod";"ANOs plantedata er kanskje lite relevante for lite vegetert mark og kyst";"The indicator describes the deviation from the expected plant community (functional signature) that is due to phosphorus availability";"";" ### n32: NIBIO: additonal data for n22 & n51 from 3Q ## r.hea: Hanno: technically, this metric is divided into two one-sided indicators (one for ""too much..."" and the other one for ""too little..."")"
"opn";"vs.41c";"g h";"Planteindikator på beite/slått";"2";"MDir, NINA (Joachim Töpper)";"2019";"1";"fylke/region";"B3";"B3, B1a, B1a";"fg, bm";"u";"mod";"";"The indicator describes the deviation from the expected plant community (functional signature) that is due to grazing/mowing";"";" ### n32: NIBIO: additonal data for n22 & n51 from 3Q ## n54: BC: Technically, this indicator can be calculated for all ETs (including the natural subtypes), and IMHO it is also meaningful/ salient there as a metric (e.g. for overgrazing by cervids / reindeers), so I added an ""1?"" for the natural subtypes. ## r.hea: Hanno: technically, this metric is divided into two one-sided indicators (one for ""too much..."" and the other one for ""too little..."")"
"opn";"vs.41d";"g h l k f";"Planteindikator på jordforstyrrelse";"2";"MDir, NINA (Joachim Töpper)";"2019";"1";"fylke/region";"B3";"B3, B1a, B1a";"fg, bm";"u";"mod";"ANOs plantedata er kanskje lite relevante for lite vegetert mark og kyst";"The indicator describes the deviation from the expected plant community (functional signature) that is due to soil disturbance";"";" ### n32: NIBIO: additonal data for n22 & n51 from 3Q ## r.hea: Hanno: technically, this metric is divided into two one-sided indicators (one for ""too much..."" and the other one for ""too little..."")"
"opn";"vs.64";"g h l k f";"Slitasje";"2";"NINA (Anders Kolstad)";"2019";"5";"annet";"B3";"B3";"pr";"n";"abs";"påvirkning";"The indicator represents anthropogenic damage or disturbance to soils and vegetation, typically from recreational activities and off-road vehicles.";"";"The indicator is based on the NiN variables 7TK, PRTK, 7SE and 7SL. Not decided whether this will be included in the final set of indicators. ### n32: NIBIO: Also relevant for n22 due to excessive livestock trampling AK: OK; but livestock trampling is not recorded with the underlying NiN variables ## d.them.scope: ALK: combinations (intersections) between regions and a four-tiered infrastructure index"
"opn";"fj.04";"h f";"Lirype";"3";"NINA";"2015";"1";"fylke/region";"B1a";"B1a";"fb, fg";"p";"exp";"";"The indicator is the density of adult willow ptarmigans (Lagopus lagopus) per km2 in August, as a mean for the last 5 years";"";" ### i.description: or Willow ptarmigan? ## n41: BC: can also occur in northern / higher elevation forests / wetlands HS/EF: maybe, but not specific enough there ## d.startdate: The dataset is based on transect sampling in willow grouse habitat in August. As of 2020, there are 181 assessment areas in 75 municipalities (Nilsen & Rød-Eriksen 2020).  ## d.spat.res: NB: temporal autocorrelation due to the moving average"
"opn";"fj.05";"f";"Fjellrype";"3";"MDir";"2010";"1";"fylke/region";"B1a";"B1a";"fb, fg";"p";"exp";"";"The indicator is the estimated density of adult rock ptarmigans (Lagopus muta) in the breeding season based on point and transect samples";"";" ### i.description: or Rock ptarmigan? ## n53: just mountain ## d.startdate: The data come from transect sampling in fixed quadrats in the mountains in the breeding season; for all ecosystems, a total of just under 500 quadrats are stratified randomly selected from a systematic grid of Norway (Kålås et al. 2021). The indicator is a relative abundance index where annual values are scaled to the abundance in 2010, as a mean for the last 5 years. Spatially representative due to a systematic data collection design.  ## d.spat.res: NB: temporal autocorrelation due to the moving average"
"opn";"vs.18";"j+Å";"Hekkefugl i jordbrukslandskapet";"1";"NINA (Chloe Nater), BirdLife Norge, Mdir, NIBIO";"2010";"1";"fylke/region";"B1a";"B1a, B1b";"bm";"p";"sta";"arter tilordnet konseptuelt til åpent kulturlandskap";"Aggregated index for birds associated with open lowland  ecosystem types (croplands, grasslands, heathlands).";"";"A combined index for all open lowland (crop + gras + heath), EU-relevant, data from TOV-E (NINA/BirdLife) and 3Q (NIBIO) need to be merged ### n53: just lowland ## n54: BC&ALK: Why ""farmaland birds"" can typically live in any open areas, n52 & n54 in Norway are typically confined to mountains... so this indicator is probably less relevant there. ## n6: BC&ALK: Why ""farmaland birds"" can typically live in any open areas, n52 & n54 in Norway are typically confined to mountains... so this indicator is probably less relevant there. ## d.startdate: NIBIO: 3Q monitoring can also be relevant for this indicator in the future ## d.temp.aggr: real agroecosystems possibly only from later? (based on 3Q) ## d.them.scope: ALK: just two big regions (southern and northern Norway)"
"opn";"vs.13";"k";"Hekkefugl i våtmark";"1";"NINA (Chloe Nater), BirdLife Norge, Mdir, NIBIO";"2010";"1";"fylke/region";"B1a";"B1a, B1b";"bm";"p";"sta";"bør avgrenses til kystvåtmark";"Aggregated index for birds associated with wetlands";"";"Hanno: It seems to me that vsa.13 and vsa.18 are the same indicator, only for different ecosysstems. I will know more in 2 weeks or so, when the project has delivered code. ### d.startdate: EF: the standard terrestrial bird monitoring (TOV-E) won't provide representative data for this group but BirdLife may have other monitoring data ## d.temp.res: BC: filled in based on the Farmland birds ## d.them.scope: ALK: just two big regions (southern and northern Norway) ## r.dir: If not merged with vs.18! Otherwise ""fo"""
"opn";"fj.03";"f";"Smågnagere";"3";"MDir";"1990";"1";"fylke/region";"B1a";"B1a, B3";"fb, fg, fs";"p";"mod";"";"The indicator is the average abundance for population peaks in the small rodent community (mainly of lemmings and root voles) in mountain areas over the last 10-year period (currently 2010-2019).";"";"Small rodents is one of 28 indicators in the ecosystem condition indicator |  nature index for mountains (modified). ### n53: EF: only relevant/covered in the mountains NIBIO: future monitoring will only cover low and mid alpine zones ## d.startdate: Trapping data of small rodents from selected monitoring sites, including the sites of the terrestrial nature monitoring program (TOV), Finse, and published data series in Ehrich et al. (2020), supplemented with other quantitative and qualitative information about the occurrence of small rodent population peaks in mountain areas. Most data are actual catch data coming from a limited number of ~1 km2 study sites, representative for the mountain areas (mainly the low alpine zone) of the country (excluding coastal mountains in the west and north). Data are processed in the same way as for the Nature Index, aggregating data and qualitative information for groups of counties to represent regional data. ## d.temp.aggr: Monitoring of small mammals by camera traps started in 2023. Re-calibration with the old snaptrapping data will be needed. ## d.spat.res: BC: moving average aggregation conflicts with accounting principles, this shd be probably longer than 1 yr"
"opn";"fj.08";"f";"Kongeørn";"3";"MDir & NINA";"2010";"5";"ingen (nasj)";"B1a";"B1a";"fb, fg";"p";"exp";"";"The indicator is the estimated number of occupied territories for the period 2015-2019.";"";" ### n53: just mountain ## d.startdate: The calculation is based on data from Rovdata (https://rovdata.no/). Golden eagle territories have been registered for several years and documented in Rovdata. Some of these territories are monitored. Monitoring is coordinated by SNO and it is divided into one intensive and one extensive programme. Data collection is carried out by SNO and amateurs (see https://rovdata.no/Kongeørn.aspx). These data are used to run models to estimate how many of the total number of territories are inhabited. The indicator is the estimated number of occupied territories. The extensive monitoring programme of breeding populations of golden eagle is designed to cover all of Norway but is not able to cover all breeding territories (Mattisson et al. 2020). ## d.temp.res: BC: expressing both the metric and the references as ""densities"" may suggest an improved (more intuitive) scalability (more compatible with accounting principles) ## d.temp.aggr: Data on golden eagle nesting are assembled annually with various methods for diverse regions (incomplete national coverage). National population numbers can be estimated on an irregular basis (first estimate was 2010-2014, second for 2015-2019). ## d.spat.res: Data on golden eagle nesting are assembled annually with various methods for diverse regions (incomplete national coverage). National population numbers can be estimated on an irregular basis (first estimate was 2010-2014, second for 2015-2019)."
